{
  "date": "2026-10-26",
  "total": 287,
  "ok": 287,
  "dead": 0,
  "unreachable": 0,
  "statuses": {
    "AbdalV2rayBot": "ok",
    "addvless_bot": "ok",
    "AegisVPN_Robot": "ok",
    "aerivpn_bot": "ok",
    "AIDVPNbot": "ok",
    "aifinef_bot": "ok",
    "akenaivpn_bot": "ok",
    "akonit_tech_bot": "ok",
    "alibi_vpnbot": "ok",
    "Alice_VPN_bot": "ok",
    "aliusvpn_bot": "ok",
    "AllRoadVPNBot": "ok",
    "alphavless_bot": "ok",
    "altaron_vpn_bot": "ok",
    "amma_vpn_bot": "ok",
    "Amnyam_VPNbot": "ok",
    "AnkoraNetBot": "ok",
    "apexpn_bot": "ok",
    "appavpn": "ok",
    "ARDESvpn_bot": "ok",
    "Aress_vpn_bot": "ok",
    "ArixoVpnBot": "ok",
    "asbvpn_bot": "ok",
    "AskaVPN_bot": "ok",
    "astra_net_bot": "ok",
    "atlantavpn_bot": "ok",
    "atomic_vpn_bot": "ok",
    "Azgard_VPN_bot": "ok",
    "bananVPN_bot": "ok",
    "BaobabVpnBot": "ok",
    "barbos_vpn_bot": "ok",
    "BarryVPN_bot": "ok",
    "BearLunaVpnBot": "ok",
    "beepassvpn_bot": "ok",
    "belkanet_bot": "ok",
    "BIRD_VPN_BOT": "ok",
    "BitBanditsVpnBot": "ok",
    "blacktemple_space_bot": "ok",
    "BlackToysRobot": "ok",
    "blookvpnbot": "ok",
    "BlyatNetBot": "ok",
    "bmectevpnbot": "ok",
    "bot_vpn_bot": "ok",
    "bro_vpn_bot": "ok",
    "Buba_Top_Robot": "ok",
    "bulba_vpn_bot": "ok",
    "bulsanvpn_bot": "ok",
    "bumpvpn_bot": "ok",
    "bushido_vpn_bot": "ok",
    "buzzvpn_robot": "ok",
    "CanvasProxyBot": "ok",
    "Capybara_Store_VPN_bot": "ok",
    "CatsVPN_robot": "ok",
    "Cheburnet_Bot_VPN": "ok",
    "chfreevpn_bot": "ok",
    "ChinazesVPN_bot": "ok",
    "choosevpn_bot": "ok",
    "clickvpnrealbot": "ok",
    "cloudgatebot": "ok",
    "CryingVPN_bot": "ok",
    "CryptixVPN_bot": "ok",
    "cryptrend_vpn_bot": "ok",
    "cult_vpnbot": "ok",
    "CyberDedVPN_bot": "ok",
    "DavisVPNBot": "ok",
    "DazeLink_bot": "ok",
    "deepseek_vpn_bot": "ok",
    "defaultvpn_bot": "ok",
    "Diggyvpnbot": "ok",
    "digitalvpnbot": "ok",
    "dino_vpnbot": "ok",
    "discord_bypass_bot": "ok",
    "divevpn_bot": "ok",
    "dogma_premium_vpn_bot": "ok",
    "dothost_vpnbot": "ok",
    "dspvpn_bot": "ok",
    "DudeVPN_bot": "ok",
    "DureVpnBot": "ok",
    "DvinVPNBot": "ok",
    "dzenvpnbot": "ok",
    "easy2vpnbot": "ok",
    "easygo_vpn_bot": "ok",
    "EasyLinkVPN_bot": "ok",
    "f1vpn": "ok",
    "fadevpnbot": "ok",
    "fastmobilevpnbot": "ok",
    "FCK_RKN_bot": "ok",
    "FineVPNbot": "ok",
    "FixPriceVPN_bot": "ok",
    "fixvpn_bot": "ok",
    "flagmanvpnbot": "ok",
    "fptn_bot": "ok",
    "FRDM_VPN_BOT": "ok",
    "free_vpn_amnezia_bot": "ok",
    "freecatvpn_bot": "ok",
    "freeflyvpnbot": "ok",
    "freelinkvpn_bot": "ok",
    "FreeonVpnBot": "ok",
    "freeroamvpn_bot": "ok",
    "friendlyvpnbot": "ok",
    "FukashiBot": "ok",
    "FurkVPNbot": "ok",
    "g5vpn_bot": "ok",
    "Gagarinskyvpnbot": "ok",
    "gammaVPN_bot": "ok",
    "gemera_vpn_bot": "ok",
    "gemini_vpn_bot": "ok",
    "Gen_vpnbot": "ok",
    "Geodema_bot": "ok",
    "getvpn": "ok",
    "GhostGramVPN_Bot": "ok",
    "Gidrovpn_bot": "ok",
    "glaz_proxy_bot": "ok",
    "glushvpn_bot": "ok",
    "go_vpn": "ok",
    "goldmanvpn_robot": "ok",
    "GostikVPNbot": "ok",
    "GraceVPN_bot": "ok",
    "gramadsvpnbot": "ok",
    "GrizzlyVpnXBot": "ok",
    "GuardianVPN": "ok",
    "GuardianVPNBot": "ok",
    "GuavaVPNBot": "ok",
    "gwvpn_bot": "ok",
    "hadsvpn_robot": "ok",
    "HanmewBOT": "ok",
    "happ_vpns_robot": "ok",
    "HappiVPN_bot": "ok",
    "happpvpnbot": "ok",
    "Haru_access_bot": "ok",
    "HelperVPN_NewBot": "ok",
    "hideoutvpnrobot": "ok",
    "hitvpnbot": "ok",
    "HolyVPN_bot": "ok",
    "HorizonVPNbot": "ok",
    "Island_VPN_bot": "ok",
    "IsoraVPN_bot": "ok",
    "jetton_proxybot": "ok",
    "kapusta_vpn_bot": "ok",
    "klassvpnbot": "ok",
    "kotvpn_bot": "ok",
    "LagomVPN_bot": "ok",
    "lastdepvpn_bot": "ok",
    "lumovpnbot": "ok",
    "ma3x_vpn_bot": "ok",
    "Magnumvpnbot": "ok",
    "marfabot": "ok",
    "marzbaninfobot": "ok",
    "matushka_zemlyabot": "ok",
    "midas_vpn_bot": "ok",
    "milas_vpn_bot": "ok",
    "Moriartyvpnbot": "ok",
    "mtpro_xyz_bot": "ok",
    "MTProxybot": "ok",
    "MTProxyME_bot": "ok",
    "myartvpn_bot": "ok",
    "MyBatyaOnline_bot": "ok",
    "myMTProxy_bot": "ok",
    "nablagovpn_bot": "ok",
    "NachosVPN_bot": "ok",
    "nackevpn_bot": "ok",
    "nebo_vpn_bot": "ok",
    "neovpnbot": "ok",
    "NextGenVPN_bot": "ok",
    "noctovpn_bot": "ok",
    "NoNamVPN_bot": "ok",
    "nopropaganda_bot": "ok",
    "nullvpn_robot": "ok",
    "Num1Vpnbot": "ok",
    "nuvpnubot": "ok",
    "official_vpnbot": "ok",
    "ogionebot": "ok",
    "okak_vpnbot": "ok",
    "omeganw_bot": "ok",
    "opengatevpn_bot": "ok",
    "openspace_vpn_bot": "ok",
    "opentunbot": "ok",
    "openworld": "ok",
    "opsvpnbot": "ok",
    "OutlineKeysRobot": "ok",
    "OutlineVpnBot": "ok",
    "paper_vpn_bot": "ok",
    "persik_vpnbot": "ok",
    "PictureNetBot": "ok",
    "plan_vpn_bot": "ok",
    "PlanetVPN_bot": "ok",
    "PotatoFreeVPNBot": "ok",
    "proxy_socks5_bot": "ok",
    "prvtvpnbot": "ok",
    "QuattroVPN_BOT": "ok",
    "ResetVPN_bot": "ok",
    "rkt_vpn_bot": "ok",
    "rosvpnbot": "ok",
    "RuFox_VPN_bot": "ok",
    "SaturnVPN_bot": "ok",
    "servsns_bot": "ok",
    "sevenvpn_bot": "ok",
    "ShadownetVPNbot": "ok",
    "ShadowSocks_bot": "ok",
    "shark_shop_bot": "ok",
    "siriusvpnbot": "ok",
    "SlippyVPNbot": "ok",
    "SnowfallVPN_bot": "ok",
    "socks5_bot": "ok",
    "sotavpnbot": "ok",
    "space_connect_bot": "ok",
    "space_tunnel_bot": "ok",
    "Sports_link_bot": "ok",
    "spoti_premium_bot": "ok",
    "sssrvpn_bot": "ok",
    "stealthsurf_vpn_bot": "ok",
    "straus_vpn_bot": "ok",
    "Svyazvpn_bot": "ok",
    "telega_vpn_robot": "ok",
    "telegavpn_bot": "ok",
    "theinsvpnbot": "ok",
    "TipTopNet_VPN_bot": "ok",
    "to_aliusvpn_bot": "ok",
    "tonplay_proxybot": "ok",
    "tonvpn_bot": "ok",
    "Top_Vpn_shop_bot": "ok",
    "TriBukvyRoBot": "ok",
    "trustvpn_official_bot": "ok",
    "ulet_vpn_bot": "ok",
    "Ultaclub_bot": "ok",
    "ultimavpnbot": "ok",
    "UnlockedVPNbot": "ok",
    "upx_vpn_bot": "ok",
    "vamproxy_bot": "ok",
    "vamtlgrm_bot": "ok",
    "VANYA_VPN_BOT": "ok",
    "vasinvpn_bot": "ok",
    "velvet_vpn_bot": "ok",
    "ventravpn_bot": "ok",
    "vezarysbot": "ok",
    "vinnypux_vpn_bot": "ok",
    "vitalik_vpn_bot": "ok",
    "vless_space_bot": "ok",
    "vless_vpn_shop_bot": "ok",
    "vlessfree_bot": "ok",
    "vlesvpnbot": "ok",
    "vnespiskabot": "ok",
    "Vpn_best_price_bot": "ok",
    "vpn_free": "ok",
    "Vpn_Ghost_Robot": "ok",
    "vpn_liberty_bot": "ok",
    "vpn_mmg_bot": "ok",
    "vpn_plus777_bot": "ok",
    "VPN_RAKETA_BOT": "ok",
    "Vpn_Save_Bot": "ok",
    "vpn_spacev_bot": "ok",
    "vpn_telegrambot": "ok",
    "vpn1probot": "ok",
    "vpnbot": "ok",
    "VPNDendibot": "ok",
    "vpndriftbot": "ok",
    "vpneasybot": "ok",
    "vpnfail_bot": "ok",
    "vpngeneratorbot": "ok",
    "VpnGhostyBot": "ok",
    "VPNGooBot": "ok",
    "vpngranitbot": "ok",
    "VPNhub_robot": "ok",
    "VPNLuxury_robot": "ok",
    "vpnminibot": "ok",
    "VPNPPLBot": "ok",
    "vpnsave": "ok",
    "vpnsolid_bot": "ok",
    "vpntelegramrobot": "ok",
    "vpntypebot": "ok",
    "VPNVezdehodBot": "ok",
    "vpnvlesss_bot": "ok",
    "VPNWG_BOT": "ok",
    "webofrussia_vpn_bot": "ok",
    "wrgrdtgbot": "ok",
    "wtfprivetbot": "ok",
    "X_Rocket_VPN_bot": "ok",
    "xtls_vless_vpn_bot": "ok",
    "xtra_proxy_bot": "ok",
    "yavpn_robot": "ok",
    "You_vpn_bot": "ok",
    "YoutuberVPN_bot": "ok",
    "YzeNet_bot": "ok",
    "zapretvpns_bot": "ok",
    "zavoz_vpn_bot": "ok",
    "zero_ping_vpn_bot": "ok",
    "zlupavpnbot": "ok"
  }
}
